{
  "meta": {
    "mode": "archive",
    "material": "某保障产品宣传海报（模拟材料）",
    "type": "保险营销宣传海报",
    "product": "某保障产品（模拟）",
    "department": "市场部",
    "submitter": "张某",
    "date": "2026-07-30",
    "conclusion": "⚠️ 有条件通过",
    "riskLevel": "🟡 中风险",
    "docNo": "XIAOBAO-2026-DEMO-001",
    "source": "文档读取"
  },
  "summary": {
    "intro": "本次审查发现 1 项需要修改的问题。",
    "high": "无",
    "mid": "1 项（风险提示不够醒目）",
    "low": "无",
    "core": "完成风险提示整改并经人工复核后方可发布。"
  },
  "problems": [
    {
      "no": 1,
      "title": "风险提示不够醒目",
      "risk": "🟡 中风险",
      "dimension": "风险提示",
      "excerpt": "风险提示位于海报底部，字号明显小于主体文案。",
      "rule": "风险提示应清晰、醒目且与主体宣传内容相匹配",
      "basis": [
        "根据适用于本材料的消费者权益保护和保险销售行为规范，风险提示不得被弱化。正式归档前须核验适用主体、产品类型及具体条款。"
      ],
      "suggestion": "提高风险提示字号和对比度，移至主体卖点附近，并确保移动端可读。"
    }
  ],
  "evaluation": [
    {
      "dim": "风险提示",
      "score": "2/5",
      "note": "提示存在，但展示强度不足。"
    },
    {
      "dim": "信息完整",
      "score": "4/5",
      "note": "主体信息基本完整。"
    }
  ],
  "evaluationSummary": "完成风险提示整改并经合规人员复核后，可进入发布审批。",
  "remediation": [
    {
      "no": 1,
      "item": "强化风险提示的字号、位置与对比度",
      "level": "🟡 中风险",
      "deadline": "重新发布前",
      "owner": "市场部"
    }
  ]
}
